{"type":"config","name":"nvim startup optimization","metricName":"startup_ms","metricUnit":"ms","bestDirection":"lower"}
{"run":1,"commit":"c3ac460","metric":15.7,"metrics":{},"status":"keep","description":"Baseline: average of 5 runs (26.6/17.7/15.3/16.6/15.4), cold run excluded → ~15.7ms","timestamp":1775594790823,"segment":0,"confidence":null,"iterationTokens":139,"asi":{"hypothesis":"baseline measurement"}}
{"run":2,"commit":"ac37997","metric":10.93,"metrics":{},"status":"keep","description":"Defer ops/review/keymaps loading via lazy commands + vim.schedule. Avg: 10.93ms (was 15.7ms) = 30% faster","timestamp":1775595051321,"segment":0,"confidence":null,"iterationTokens":15819,"asi":{"hypothesis":"Defer review (1ms) + ops (1.2ms) + keymaps (1.4ms) from synchronous loading"}}
{"run":3,"commit":"7b837f4","metric":10.4,"metrics":{},"status":"keep","description":"Batch vim.opt calls into single vim.cmd(:set). Avg: 10.4ms (was 10.93ms)","timestamp":1775595181779,"segment":0,"confidence":10.00000000000001,"iterationTokens":7328,"asi":{"hypothesis":"Batch 87 individual vim.opt calls into a single vim.cmd('set ...') to reduce API overhead"}}
{"run":4,"commit":"7b837f4","metric":12.2,"metrics":{},"status":"discard","description":"Disable rplugin/spellfile runtime plugins + merge FileType autocmds. Avg: 12.2ms (was 10.4ms) — worse, noise","timestamp":1775595547144,"segment":0,"confidence":5.888888888888891,"iterationTokens":18812,"asi":{"hypothesis":"Disable rplugin+spellfile runtime plugins, merge FileType autocmds"}}
{"run":5,"commit":"b2714ca","metric":11.4,"metrics":{},"status":"keep","description":"All optimizations combined. Avg: 11.4ms (vs 15.7ms baseline = 27% faster). rplugin/spellfile disabled, autocmds merged.","timestamp":1775595654197,"segment":0,"confidence":6.625000000000007,"iterationTokens":4237,"asi":{"hypothesis":"All optimizations together: defer ops/review/keymaps, batch options, merge autocmds, disable rplugin/spellfile"}}
{"run":6,"commit":"0ed2627","metric":12.3,"metrics":{},"status":"keep","description":"Clear stale bytecode cache. Avg: 12.3ms (no real change, cache rebuilds on next runs)","timestamp":1775595718358,"segment":0,"confidence":7.7372262773722555,"iterationTokens":2280,"asi":{"hypothesis":"Clear stale luac cache from old neovim 0.11.6 (we're on 0.12.0)"}}
{"run":7,"commit":"acb78c7","metric":10.7,"metrics":{},"status":"keep","description":"Cache ops module ref in lualine. Avg: 10.7ms startup (stable), runtime: fewer require calls per statusline refresh","timestamp":1775595789206,"segment":0,"confidence":6.625000000000007,"iterationTokens":2567,"asi":{"hypothesis":"Cache ops module reference in lualine to avoid repeated require() calls on every statusline refresh"}}
{"type":"config","name":"nvim startup optimization round 2","metricName":"startup_ms","metricUnit":"ms","bestDirection":"lower"}
{"run":8,"commit":"604b738","metric":10.9,"metrics":{},"status":"keep","description":"Defer colorscheme to vim.schedule. Avg: 10.9ms (runs 2-10, excluding cold). Best run: 9.7ms","timestamp":1775596139013,"segment":1,"confidence":null,"iterationTokens":148,"asi":{"hypothesis":"Defer catppuccin colorscheme to vim.schedule to reduce synchronous blocking"}}
{"run":9,"commit":"fd6845c","metric":8.8,"metrics":{},"status":"keep","description":"Lazy-load catppuccin on UIEnter. Avg: 8.8ms (was 10.9ms) = 19% faster. Best: 8.6ms","timestamp":1775596201359,"segment":1,"confidence":null,"iterationTokens":2446,"asi":{"hypothesis":"Make catppuccin lazy=true + load via UIEnter autocmd. Set dark bg in options.lua as fallback"}}
{"run":10,"commit":"0f5b81c","metric":17.8,"metrics":{},"status":"keep","description":"Defer LSP to BufReadPost. File open: 17.8ms (was 20.2ms) = 12% faster. Startup unchanged at 8.8ms","timestamp":1775596353888,"segment":1,"confidence":1,"iterationTokens":7126,"asi":{"hypothesis":"Defer LSP loading from BufReadPre to BufReadPost so buffer loads first"}}
{"run":11,"commit":"0f5b81c","metric":11.6,"metrics":{},"status":"discard","description":"Move filetype registration to options, disable install.missing, increase gitsigns defer. Avg: 11.6ms (slightly worse than 8.8ms — may be noise)","timestamp":1775596411027,"segment":1,"confidence":1.5000000000000002,"iterationTokens":1689,"asi":{"hypothesis":"Move filetype.add to options.lua, remove from treesitter init, set install.missing=false, increase gitsigns defer"}}
{"run":12,"commit":"e60a7a6","metric":17.8,"metrics":{},"status":"keep","description":"Defer treesitter via after/ftplugin/lua.lua + gitsigns 200ms defer. File open: 17.8ms (stable). Startup unchanged.","timestamp":1775596553238,"segment":1,"confidence":0.7500000000000001,"iterationTokens":4212,"asi":{"hypothesis":"Override ftplugin/lua.lua to defer treesitter.start via vim.schedule, pre-apply gitsigns defer 200ms"}}
{"run":13,"commit":"7142b0d","metric":10.2,"metrics":{},"status":"keep","description":"Stagger deferred module loading in 3 priority tiers. Avg: 10.2ms (was 8.8ms for previous best). Best: 9.6ms","timestamp":1775596634866,"segment":1,"confidence":1.1999999999999997,"iterationTokens":4779,"asi":{"hypothesis":"Stagger deferred modules: keymaps vim.schedule, projects defer_fn(10ms), ops/review defer_fn(50ms)"}}
{"run":14,"commit":"7142b0d","metric":9.9,"metrics":{},"status":"discard","description":"Skip filetype for empty buffers. Avg: 9.9ms (no change). Revert.","timestamp":1775596727895,"segment":1,"confidence":2.0999999999999996,"iterationTokens":2428,"asi":{"hypothesis":"Skip filetype detection for empty buffers via BufNew autocmd","rollback_reason":"No measurable improvement (9.9ms vs 9.8ms)","next_action_hint":"Focus on runtime optimizations instead"}}
{"run":15,"commit":"667e291","metric":12.25,"metrics":{},"status":"keep","description":"Review-fix pass: avoid eager config.ops load in lualine, restore headless catppuccin loading, replace fixed defers with VeryLazy/event-based setup, align gitsigns delay to 200ms. Startup remains acceptable while removing review risks.","timestamp":1775597220491,"segment":1,"confidence":1.7499999999999996,"iterationTokens":30798,"asi":{"hypothesis":"Fix correctness/maintenance issues from review without materially hurting startup","notes":"Headless colorscheme now resolves to catppuccin-mocha; package.loaded[\"config.ops\"] stays nil on bare startup; fixed-delay init sequencing replaced by User VeryLazy callback"}}
{"run":16,"commit":"667e291","metric":11.43,"metrics":{},"status":"discard","description":"Benchmark current uncommitted review-fix patch against startup metric. Avg startup 11.43ms, worse than current kept best path; discard before resuming perf loop.","timestamp":1775597563664,"segment":1,"confidence":1.7073170731707308,"iterationTokens":16822,"asi":{"hypothesis":"Current review-fix patch may preserve correctness without materially hurting startup","rollback_reason":"Primary metric regressed versus current best startup path","next_action_hint":"Resume from clean committed state and pursue startup wins that do not reintroduce review issues","notes":"This discard only reflects the active startup benchmark target, not the value of the correctness fixes in isolation"}}
{"run":17,"commit":"667e291","metric":10.86,"metrics":{},"status":"discard","description":"Re-baseline clean committed state after reverting uncommitted review-fix patch. Avg startup 10.86ms; effectively baseline/no new improvement.","timestamp":1775597587005,"segment":1,"confidence":2.048780487804877,"iterationTokens":830,"asi":{"hypothesis":"Verify clean post-revert state before continuing the loop","rollback_reason":"No new code change and no meaningful primary-metric gain","next_action_hint":"Search for next startup win from the clean 667e291 state","notes":"Current clean state is slightly below the 10.90 baseline but within noise"}}
{"run":18,"commit":"667e291","metric":12,"metrics":{},"status":"discard","description":"Profile current interactive startup path. Confirmed catppuccin still lands on the critical path via UIEnter; no new code change kept.","timestamp":1775597651412,"segment":1,"confidence":2.5609756097560963,"iterationTokens":7514,"asi":{"hypothesis":"Current startup regression is dominated by catppuccin loading during interactive UIEnter","rollback_reason":"Profiling-only run; no code change and no primary-metric gain","next_action_hint":"Try lighter theme-loading strategy that preserves headless correctness without loading full catppuccin before start","notes":"Observed require(catppuccin) + colors file before NVIM STARTED in interactive +quit path"}}
{"run":19,"commit":"667e291","metric":11,"metrics":{},"status":"discard","description":"Compact init.lua command registrations into data-driven tables to reduce parse/closure overhead. Avg startup 11.00ms; no meaningful win over clean state.","timestamp":1775597725808,"segment":1,"confidence":2.333333333333332,"iterationTokens":2957,"asi":{"hypothesis":"Smaller init.lua parse footprint may shave startup time without changing behavior","rollback_reason":"Primary metric did not improve enough over current clean state","next_action_hint":"Look for plugin-side wins larger than init.lua micro-optimizations","notes":"Table-driven command registration was functionally equivalent but only noise-level improvement"}}
{"run":20,"commit":"79a9600","metric":10.29,"metrics":{},"status":"keep","description":"Disable nonessential built-in runtime plugins on startup: editorconfig, man, net, osc52 (alongside existing disabled plugins). Startup avg 10.29ms from clean 10.86ms.","timestamp":1775597774393,"segment":1,"confidence":2.6249999999999973,"iterationTokens":319,"asi":{"hypothesis":"A few built-in runtime plugins still on the critical path are not worth their startup cost","notes":"Headless colorscheme still resolves correctly; file-open path stayed in the same range (~20.4ms)","plugin_disable_set":["editorconfig","man","net","osc52"]}}
{"run":21,"commit":"140c439","metric":10.14,"metrics":{},"status":"keep","description":"Reduce ShaDa persistence footprint to lower startup I/O (`shada='20,<20,s10,h`). Startup avg 10.14ms from 10.29ms.","timestamp":1775597813348,"segment":1,"confidence":2.692307692307694,"iterationTokens":284,"asi":{"hypothesis":"A smaller but still useful ShaDa footprint can shave startup I/O without fully disabling persistence","notes":"Headless confirmed option applied; file-open path stayed roughly flat (~21ms)","shada":" '20,<20,s10,h "}}
{"run":22,"commit":"54d94c9","metric":9.71,"metrics":{},"status":"keep","description":"Defer nvim-treesitter plugin load from BufReadPre to BufReadPost. Startup avg 9.71ms; file-open avg improved to ~18.8ms.","timestamp":1775597864323,"segment":1,"confidence":2.7631578947368425,"iterationTokens":276,"asi":{"hypothesis":"Treesitter plugin scaffolding does not need to be on BufReadPre; shifting it to BufReadPost should reduce both startup and first-file open latency","notes":"Built-in filetype/ftplugin still provide syntax startup; plugin-side treesitter config now lands later with no benchmark cheating","secondary_file_open_ms":18.8}}
{"run":23,"commit":"54d94c9","metric":11,"metrics":{},"status":"discard","description":"Replace bootstrap runtimepath Lua loop with string.find on vim.o.runtimepath. No meaningful startup win.","timestamp":1775597908531,"segment":1,"confidence":2.692307692307694,"iterationTokens":2631,"asi":{"hypothesis":"String search on runtimepath may be cheaper than iterating vim.opt.rtp:get()","rollback_reason":"Primary metric regressed versus current best clean state","next_action_hint":"Keep bootstrap as-is and look for larger wins in plugin/event strategy","notes":"This micro-optimization was noise-level and not worth keeping"}}
{"run":24,"commit":"54d94c9","metric":10.71,"metrics":{},"status":"discard","description":"Remove vim-ember-hbs plugin and rely on Treesitter for .hbs. Startup regressed; revert.","timestamp":1775597962540,"segment":1,"confidence":2.999999999999995,"iterationTokens":2081,"asi":{"hypothesis":"Treesitter alone may make vim-ember-hbs unnecessary and remove its ftdetect startup cost","rollback_reason":"Primary metric regressed versus current best state","next_action_hint":"Keep ember plugin and look elsewhere","notes":"Filetype still resolved to handlebars with glimmer language in test buffer, but startup did not improve"}}
{"run":25,"commit":"54d94c9","metric":10.43,"metrics":{},"status":"discard","description":"Reduce ShaDa further to `shada='10,<10,s10,h'`. Startup regressed versus current best; revert.","timestamp":1775597999525,"segment":1,"confidence":2.9999999999999987,"iterationTokens":1348,"asi":{"hypothesis":"There may still be small startup I/O gains from a slightly smaller but still nonzero ShaDa footprint","rollback_reason":"Primary metric regressed versus current best 9.71ms state","next_action_hint":"Keep the milder ShaDa setting and stop pushing persistence cuts further","notes":"Pushing ShaDa smaller started to hurt or fall into noise, so current milder compromise is the right trade-off"}}
{"run":26,"commit":"54d94c9","metric":11.29,"metrics":{},"status":"discard","description":"Delay interactive Catppuccin load to VimEnter + vim.schedule while keeping headless eager. Startup regressed versus current best.","timestamp":1775598221160,"segment":1,"confidence":3.0000000000000027,"iterationTokens":1942,"asi":{"hypothesis":"Moving interactive theme load later than UIEnter may keep headless correctness and shave critical-path startup time","rollback_reason":"Primary startup metric regressed versus current best 9.71ms state","next_action_hint":"Do not chase theme-trigger variants further without a different lightweight fallback strategy","notes":"Simple VimEnter scheduling was not enough to beat the current theme path"}}
{"run":27,"commit":"54d94c9","metric":9.86,"metrics":{},"status":"discard","description":"Defer OPS/Review command registration itself to VeryLazy instead of startup. Startup slightly regressed versus current best 9.71ms.","timestamp":1775598299593,"segment":1,"confidence":2.9999999999999987,"iterationTokens":3843,"asi":{"hypothesis":"Command registration may be cheap but still worth moving fully off the startup path","rollback_reason":"Primary startup metric regressed relative to current best state","next_action_hint":"Keep command wrappers at startup; they are not the main bottleneck","notes":"Moving command registration later did not buy enough to offset other scheduling effects"}}
{"run":28,"commit":"54d94c9","metric":10.57,"metrics":{},"status":"discard","description":"Disable built-in runtime plugin `shada.lua` while keeping ShaDa persistence. Startup regressed versus current best.","timestamp":1775599978320,"segment":1,"confidence":3.1818181818181808,"iterationTokens":5156,"asi":{"hypothesis":"Disabling the runtime helper plugin for ShaDa may shave a small startup cost without removing persistent state","rollback_reason":"Primary startup metric regressed versus current best 9.71ms state","next_action_hint":"Keep current built-in disable set; further built-in pruning appears exhausted","notes":"`shada.lua` helper itself was not the next bottleneck"}}
