{"type":"config","name":"simplify-etabli","metricName":"surface","metricUnit":"lines","bestDirection":"lower"}
{"run":0,"commit":"fa9c5b6","metric":15181,"metrics":{"skills_md":113,"skill_kb":337,"ts_lines":1927,"script_lines":8054,"workflow_lines":5200,"verify_s":81,"verify_ok":1},"status":"keep","description":"baseline: deterministic surface counts + verify core wall time; checks.sh green (242 pass)","timestamp":1787515632035,"segment":0,"confidence":null,"asi":{"hypothesis":"establish baseline before any deletion","verify_s_noise":"81s this run vs 39s earlier same tree — wall time noisy, treat single runs as advisory; surface is deterministic","next":"iteration 1: merge linear-* skill family"}}
{"type":"config","name":"simplify-etabli","metricName":"surface","metricUnit":"lines","bestDirection":"lower"}
{"run":1,"commit":"e303243","metric":65134,"metrics":{"skills_md":373,"skill_kb":1696,"vendor_lines":49953,"ts_lines":1927,"script_lines":8054,"workflow_lines":5200,"verify_s":41,"verify_ok":1},"status":"keep","description":"segment-1 baseline after rescoping primary to include vendor/ (260 md, ~50k lines, 77% of surface); checks.sh green (242 pass)","timestamp":1787515826351,"segment":1,"confidence":null,"asi":{"hypothesis":"baseline with complete maintained surface","insight":"verify-skills-lock sha256-hashes every locked skill each core run - vendor cuts improve surface AND verify_s together","next":"iteration 1: merge linear-* skill family"}}
{"run":2,"commit":"18bc2f0","metric":31819,"metrics":{"skills_md":263,"skill_kb":866,"vendor_lines":16665,"ts_lines":1927,"script_lines":8054,"workflow_lines":5173,"verify_s":40,"verify_ok":1},"status":"keep","description":"iteration 1: remove vendor/mcollina-skills (7 generic skills, 29.4k lines) + vendor/tanstack-start-skills (18 undeployed-in-work skills, 4.1k lines); catalog 95->68 rows, lock 79->52, smoke fixtures repointed to vercel-react-best-practices","timestamp":1787516132412,"segment":1,"confidence":null,"asi":{"hypothesis":"generic knowledge packs and undeployed personal packs are pure surface tax","result":"surface -51.2% (65134->31819), skill_kb -49%, skills_md -29.5%; verify core green, 242 ext tests green","surprise":"verify_s unchanged (40s) - skill hashing was NOT the bottleneck; next lever: profile verify core phases (bun audit network? smoke tests?)","upstream_restore":"both packs restorable via vendor/sources.tsv rows + scripts/sync-vendor-skills (mcollina public MIT, tanstack is user-owned repo)"}}
{"run":3,"commit":"23f6f9c","metric":31819,"metrics":{"skills_md":263,"skill_kb":866,"vendor_lines":16665,"ts_lines":1927,"script_lines":8054,"workflow_lines":5173,"verify_s":11,"verify_ok":1},"status":"keep","description":"iteration 2: workflow-contract-coverage-smoke built one grep index over claude/pi/docs/README/spec instead of one recursive grep per contract (24 walks over pi/node_modules=21k files); orphan-probe negative case still caught, same error message","timestamp":1787516305460,"segment":1,"confidence":null,"asi":{"hypothesis":"per-contract recursive greps over a 210MB tree dominated verify core","result":"verify_s 40->11s (-72.5%); smoke itself 24->3s; surface unchanged (test-body delta negligible)","note":"assertion semantics preserved: pass iff exact path string appears in any searched surface"}}
{"run":4,"commit":"44f9e6c","metric":31819,"metrics":{"skills_md":263,"skill_kb":866,"vendor_lines":16665,"ts_lines":1927,"script_lines":8054,"workflow_lines":5173,"verify_s":10,"verify_ok":1},"status":"keep","description":"confirmation run 1/3: surface deterministic, verify_s stable","timestamp":1787516364198,"segment":1,"confidence":null,"asi":{"note":"both targets met: surface 31819<=32567, verify 10s<=20s"}}
{"run":5,"commit":"44f9e6c","metric":31819,"metrics":{"skills_md":263,"skill_kb":866,"vendor_lines":16665,"ts_lines":1927,"script_lines":8054,"workflow_lines":5173,"verify_s":10,"verify_ok":1},"status":"keep","description":"confirmation run 2/3: verify_s=11","timestamp":1787516364198,"segment":1,"confidence":null,"asi":{"note":"noise floor +-1s; improvement ~30x noise floor"}}
{"run":6,"commit":"44f9e6c","metric":31819,"metrics":{"skills_md":263,"skill_kb":866,"vendor_lines":16665,"ts_lines":1927,"script_lines":8054,"workflow_lines":5173,"verify_s":10,"verify_ok":1},"status":"keep","description":"confirmation run 3/3: verify_s=10; session targets achieved","timestamp":1787516364198,"segment":1,"confidence":null,"asi":{"note":"final: surface -51.2%, verify -75%, skills_md -29.5%, skill_kb -49%"}}
{"run":1,"commit":"4056af5","metric":19304,"metrics":{"skill_kb":500,"skills_md":167,"script_lines":8054,"ts_lines":1927,"vendor_lines":4154,"verify_ok":1,"verify_s":14,"workflow_lines":5169},"status":"keep","description":"iteration 3: remove vendor/vercel-agent-skills (4 skills, 12.5k lines, 100 files); catalog 68->64 rows, lock 52->48; smoke fixtures repointed to ember; prose refs to removed skills (mcollina+vercel, stale since iter 1) cleaned across claude/README, code-quality, stack-suite, scout, worker, plan-implement, ship; codex-skill-description-smoke fixed (expected sets shrunk to herdr, iter-1 hidden breakage of full profile)","timestamp":1787516855345,"segment":0,"confidence":null,"asi":{"backlog":"remaining: dead scripts pass (~8k lines), linear-* merge, review family merge, suite-router/stack-suite/design-suite router consolidation (suite-router prose still references dead stack-suite rows), workflow/*.md consolidation","fixtures":"install-main smoke fixtures repointed vercel->ember paths; deploy/fix-links vercel assertions flipped to absent (work-scope phase already asserts ember links - vendor deploy coverage preserved)","hidden_debt_found":"codex-skill-description-smoke (full profile) was silently broken by iteration 1 fixture edit - full profile not in core measure; also install-main.sh:900 kept-skill list still referenced deleted 'node' skill; both fixed this iteration","hypothesis":"shared-scope generic React/Next knowledge pack is unused daily surface (user stacks: Ember/AdonisJS); restorable from public upstream","restore_path":"re-add vercel row to vendor/sources.tsv + scripts/sync-vendor-skills (public repo, no SSH needed)","stale_prose":"claude/README, code-quality, stack-suite, scout/worker/plan-implement/ship all referenced removed mcollina+vercel skills since iteration 1 - nothing validates prose refs; all repointed to surviving skills (ember work-scope, adonisjs personal, frontend-css-ui-ux, bug-check)"}}
{"run":2,"commit":"95035a5","metric":19304,"metrics":{"skill_kb":500,"skills_md":167,"script_lines":8054,"ts_lines":1927,"vendor_lines":4154,"verify_ok":1,"verify_s":15,"workflow_lines":5169},"status":"keep","description":"iteration 3 fix-up: repair install-smoke (kept-skill fixture caveman never linked; repointed to ember-forestadmin-suite) and workflow-docs-smoke (shared-vendor leaf invariant inverted: no shared pack means no direct leaves required, and direct leaves forbidden); full profile now 68/68","timestamp":1787517305212,"segment":0,"confidence":null,"asi":{"full_profile":"68/68 green after fixes - ran entire full profile manually since core-only measure hides full-profile breakage (lesson from codex smoke)","hypothesis":"fix-ups to iteration 3: kept-skill fixture pointed at never-created caveman link (now ember-forestadmin-suite); workflow-docs-smoke required >=1 shared-vendor leaf in code-quality table but shared vendor set is now empty by design - invariant inverted (empty set requires zero direct leaves, both directions enforced)","next":"iteration 4 from ideas.md: dead scripts pass or linear-* merge"}}
{"run":3,"commit":"10c06da","metric":19303,"metrics":{"skill_kb":497,"skills_md":166,"script_lines":8054,"ts_lines":1927,"vendor_lines":4154,"verify_ok":1,"verify_s":17,"workflow_lines":5168},"status":"keep","description":"iteration 4: delete hollow stack-suite router (2 live rows folded into suite-router; Node/backend row retired honestly - no vendored suite left); design-suite kept intact; smoke fixtures repointed (design-suite), workflow-docs inactive list updated; also recorded: dead-scripts hypothesis refuted by full reference map (all scripts have living consumers)","timestamp":1787517511476,"segment":0,"confidence":null,"asi":{"dead_scripts_verdict":"analysis-only iteration: built full reference map for every scripts/* entry - every script has a living consumer (smoke test, installer link, manifest row, or config); ~8k 'dead scripts' hypothesis from ideas backlog REFUTED, no code change","hypothesis":"stack-suite router was hollow after vendor removals (2 live rows: react-doctor-100, adonisjs-suite) - fold into suite-router and delete; design-suite kept (dense live orchestrator, not a duplicate)","next":"workflow/*.md loop-docs consolidation (5.1k lines) or linear-* merge (touches keepList test contract - riskier)"}}
{"run":4,"commit":"HEAD","metric":19303,"metrics":{"skill_kb":497,"skills_md":166,"script_lines":8054,"ts_lines":1927,"vendor_lines":4154,"verify_ok":1,"verify_s":14,"workflow_lines":5168},"status":"keep","description":"iteration 5 (closure): refuted all remaining backlog hypotheses with evidence (linear-* merge = router-integrated distinct intents, merging would overfit surface metric at daily-efficiency cost; review family = 3 distinct contracts; loop-docs = no real duplication); absorbed pending formatter fix; full profile 68/68 re-verified; ideas.md deleted per exhausted-paths rule; final confirmation run","timestamp":1787517862847,"segment":0,"confidence":2,"asi":{"closure":"all ideas.md paths exhausted by evidence; file deleted per skill rules; final summary lives in .auto/prompt.md","full_profile":"68/68 green on final tree (re-verified before this run)","hypothesis":"closure iteration: test the three remaining backlog hypotheses against evidence before any code change; none survived - linear-* merge would degrade router precision (overfitting the surface metric), review family and loop contracts are genuinely distinct","refutations":"linear-*: routes wired into router engine (2 runtimes), pinned by router-eval min-accuracy 1 + scenario fixture, merging create-vs-implement intents = daily-efficiency regression; review family: 3 distinct contracts (diff/gh-flow-HITL/security-audit); loop-docs: 178/131/70 lines, no true duplication, coverage-smoke guarded","session_final":"surface 65134->19303 (-70.4%), skills_md 373->166 (-55%), skill_kb 1696->497kb (-70.7%), verify_s 41->14s (-66%); all four targets exceeded; every cut reversible via vendor/sources.tsv + sync-vendor-skills"}}
{"run":5,"commit":"HEAD","metric":19303,"metrics":{"skill_kb":497,"skills_md":166,"script_lines":8054,"ts_lines":1927,"vendor_lines":4154,"verify_ok":1,"verify_s":14,"workflow_lines":5168},"status":"keep","description":"iteration 6: complete deployment of iterations 1-3 by pruning 33 dangling repo-managed skill links from home agent surfaces (exact prune_stale_managed_skill_links semantics: target under repo roots + missing); repo metric unchanged by design (deployment state, not repo surface); repo still green core+checks","timestamp":1787518126456,"segment":0,"confidence":null,"asi":{"deployed_delta":"71->38 dangling across 4 agent surfaces; ~/.claude/skills now 0 dangling (85->74 links); pruned exactly 33 repo-managed links (11 removed skills x 3 surfaces); remaining 38 are external (~/.codex/vendor_imports design/french skills) - outside repo authority, preserved by design","effect":"every future Claude/Codex/Grok/pi session stops enumerating 33 dead skills (vercel-*, node, oauth, fastify, typescript-magician, linting, nodejs-core, documentation, web-design-guidelines); this session's own available_skills list carried them","gap_note":"check-fix-symlinks.sh has no prune; install.sh (the tested pruner) has unrelated network branches (brew/rtk/plugins) I would not trigger autonomously - surgical path replicates only the managed-root deletion set","hypothesis":"iterations 1-3 removed vendor packs from the repo but the deployed home surfaces still advertised 33 dead skill links to every agent session - completing deployment is real daily-efficiency work the repo benchmark cannot see","primary_unchanged_because":"no repo code changed; metric intentionally NOT extended to home dirs (no goalpost moving); value documented in asi","restore":"re-adding packs via vendor/sources.tsv + sync-vendor-skills + install re-creates links"}}
{"run":6,"commit":"HEAD","metric":19303,"metrics":{"skill_kb":497,"skills_md":166,"script_lines":8054,"ts_lines":1927,"vendor_lines":4154,"verify_ok":1,"verify_s":14,"workflow_lines":5168},"status":"keep","description":"iteration 7: extend deployment completion beyond skill dirs - pruned 9 dangling repo-managed ~/.local/bin executables (yabai/macos/iterm2/model-network-tune scripts removed from repo by pre-session commits, zero living consumers in tracked configs); also verified never-swept surfaces (docs, workflow-scaffold, .github, herdr) are clean of dead skill refs and classified .workflow/ as protected runtime history; repo green core+checks, metric unchanged","timestamp":1787518281493,"segment":0,"confidence":null,"asi":{"class":"same as iteration 6 (deployment completion of past repo deletions) - these 9 predate this session: targets removed by earlier commits (a7ae9a7 desktop editor extras, ecec03c vanilla harness descope)","consumers_check":"grep across tracked configs (tmux.conf, nvim, herdr, claude hooks) found zero living callers of any of the 9 scripts - no latent breakage","gap_scan_results":"never-swept tracked surfaces verified clean: docs/, workflow-scaffold/, .github/, herdr/, mcp/, nvim/, README.md - zero dead skill references (it.3 sweep had sufficed); docs/plan has only 1 tracked file (no accumulation)","hypothesis":"repo-managed deployment residue exists beyond skill dirs: ~/.local/bin carried 9 dangling executables pointing at scripts/ paths deleted from the repo before this session","protected_left_alone":".workflow/ (87 dirs, 8MB) = gitignored runtime run history (receipts, retrospects) consumed by claude hooks ledger/supersession - user's agent-work memory, not config cruft; 6 external ~/.codex/skills french-skill links also left (outside repo authority)","result":"pruned 9/9 repo-managed dangling bin links; ~/.local/bin now 0 dangling; repo metric unchanged by design"}}
{"run":7,"commit":"b954b8c","metric":19303,"metrics":{"skill_kb":497,"skills_md":166,"script_lines":8054,"ts_lines":1927,"vendor_lines":4154,"verify_ok":1,"verify_s":14,"workflow_lines":5168},"status":"keep","description":"iteration 8 (audit-only, clean bill): ghost-route audit across all routing surfaces and catalog<->filesystem cross-check - zero ghosts found (forest-backend-suite real, spec-guide real command, research-plan commandless route, herdr symlink documented); my iterations 1-4 left no dangling references; gap recorded: non-locked catalog rows lack existence checks (YAGNI-skipped)","timestamp":1787518449570,"segment":0,"confidence":null,"asi":{"audit_scope":"routing surfaces (suite-router, design-suite, workflow-router-lib.mjs, workflow-router-runtime.ts, spec.md, agent-quick-card, contract-details) + catalog<->filesystem cross-check + agent/role references","findings":"ZERO ghosts: forest-backend-suite = real claude-scope skill (work dir); spec-guide = real command; research-plan = commandless route by design (command:none in router lib); plan-ready-guard = claude hook; pi/skills/herdr uncatalogued but a DOCUMENTED symlink to herdr/skills/herdr (herdr/docs/skills.md install cmd); planner/challenger/etc = conceptual PLAN.md roles not artifacts","gap_discovered_not_fixed":"non-locked catalog rows have NO existence check in any smoke (skill-lock hashes only locked rows; install checks only pi_core/agents_visible) - a future deletion could leave a silent shelf row; YAGNI-skipped guard, recorded for future decision","hypothesis":"iterations 1-4 deletions may have created ghost skill references in routing surfaces that no fixture pins (router-eval only covers its corpus)","value":"integrity verified: no dangling references anywhere after 4 deletion iterations; also proves the it.3/4 sweeps + fixture repoints were complete"}}
{"run":8,"commit":"b48036a","metric":19303,"metrics":{"skill_kb":497,"skills_md":166,"script_lines":8054,"ts_lines":1927,"vendor_lines":4154,"verify_ok":1,"verify_s":14,"workflow_lines":5168},"status":"keep","description":"iteration 9: close iteration-8 gap - every catalog row now requires its skill dir to exist (verify-skills-lock.mjs, core profile, catches shelf-row drift nothing else checks); negative-tested with a fake ghost row (clean failure, exit 1); also hardened the two unguarded JSON.parse entry reads flagged by diagnostics (clean fail banner instead of stack trace); zero surface cost by construction","timestamp":1787518601510,"segment":0,"confidence":null,"asi":{"design_choice":"one-directional check only (catalog row -> dir must exist); reverse direction (dir without row) would false-positive on pi/skills/herdr, a documented uncatalogued symlink - kept out deliberately","hardening_bonus":"pi-lens flagged unguarded JSON.parse of skills-lock.json and settings.json at top of script; wrapped both with fail() helper reusing the script's existing failure banner - verifier now fails with a clean message instead of a raw stack trace; both failure paths negative-tested (corrupted lock JSON -> 'invalid skills-lock.json' exit 1)","hypothesis":"close the iteration-8 recorded gap: shelf (non-locked) catalog rows had no existence check - the exact drift class this session hit 4 times manually; guard lives in verify-skills-lock.mjs (core profile, already parses the TSV)","metric_cost":"zero - pi/scripts/ is outside the surface metric (which counts root scripts/, pi/extensions, workflow, vendor); this is deliberate verification-layer hardening, not metric avoidance","negative_test":"fake row 'zz-ghost-skill ember-skills 0 0 0' appended to TSV -> clean failure 'catalog row has no skill directory' + exit 1; reverted, green restored; guard now protects the simplified state from silent drift"}}
{"run":9,"commit":"f695e3f","metric":19303,"metrics":{"skill_kb":497,"skills_md":166,"script_lines":8054,"ts_lines":1927,"vendor_lines":4154,"verify_ok":1,"verify_s":15,"workflow_lines":5168},"status":"keep","description":"iteration 10 (audit-only, clean bill): deployed-state integrity audit vs catalog+scope - all expectations met (piCore 14/14, agents_visible 14/14 incl canary, work-scope correct); every live link classified (repo-managed correct, user externals deliberate: adonisjs/tanstack clones bridged, skills.disabled archive, real-dir shared surface); honest correction logged: tanstack consumed via user clone not vendored copy; produced .auto/deployed-inventory.md decision packet; absorbed formatter rewrap of verify-skills-lock (cosmetic, diff-verified)","timestamp":1787518823063,"segment":0,"confidence":null,"asi":{"correction_to_it1":"tanstack skills ARE consumed daily - but via the user's standalone clone /Volumes/Crucial/work/tanstack-start-skills (348 files, healthy), never via the vendored snapshot (zero deployed links pointed at vendor paths); deletion rationale holds with stronger evidence","deliverable":".auto/deployed-inventory.md - user decision packet: 38 dangling externals (zero data risk, user-created), adonisjs personal-scope links under work scope (12), external clone bridges","findings":"ALL catalog expectations met on all 4 surfaces: 14/14 piCore on pi, 14/14 agents_visible on agents (incl runtime-skill-canary), work-scope correctly deployed; every live link classified: repo-managed OK / user-managed external deliberate (clones, skills.disabled archive, real-dir shared surface, cross bridges)","hypothesis":"after 42 pruned links, deployed surfaces may have drifted from catalog/scope expectations (missing canary, scope violations)","no_action_reason":"zero repo-authority violations found; remaining items are user-only decisions per AGENTS.md pause rule - documented, not acted on"}}
{"run":10,"commit":"58dac57","metric":19303,"metrics":{"skill_kb":497,"skills_md":166,"script_lines":8054,"ts_lines":1927,"vendor_lines":4154,"verify_ok":1,"verify_s":14,"workflow_lines":5168},"status":"keep","description":"iteration 11: entrypoint-docs truth audit - verified herdr-agent-state.ts contract is respected (untracked+gitignored), CLAUDE.md and global pi/AGENTS.md clean; found and fixed one pre-session stale reference (AGENTS.md:60 -> deleted docs/workflow-guide.md, repointed to consolidated README.md per commit 9466974); all entrypoint path references now resolve; repo green core+checks, metric unchanged (root AGENTS.md outside measured paths)","timestamp":1787518973878,"segment":0,"confidence":null,"asi":{"findings":"herdr-agent-state.ts contract RESPECTED (on disk, untracked, gitignored L44); CLAUDE.md clean (obvault-memory.md exists, ADR index validated by adr-smoke); pi/AGENTS.md (global entrypoint, separate file) clean; single stale ref found: root AGENTS.md:60 -> docs/workflow-guide.md, deleted pre-session by commit 9466974 (docs consolidation to single usage README)","fix":"repointed to README.md with provenance comment; zero workflow-guide refs remain; every AGENTS.md/CLAUDE.md path reference now verified to exist","hypothesis":"entrypoint docs (AGENTS.md/CLAUDE.md) are read by every agent session every project - stale path references there are a per-session daily tax, and they were never audited post-deletions","impact":"every future agent session in this repo stops chasing a dead doc path when it needs the human guide"}}
