{"run":24,"commit":"a4a1eb6","metric":19283,"metrics":{"skill_kb":497,"skills_md":166,"script_lines":8028,"ts_lines":1927,"vendor_lines":4160,"verify_ok":1,"verify_s":14,"workflow_lines":5168},"status":"keep","description":"docs(autoresearch): refresh stale final summary to true state","timestamp":1787521665488,"segment":0,"confidence":4.5,"asi":{"finding":"the Final summary block (the merge-reviewer-facing section) was written at iteration-13 era and never refreshed across 11 subsequent iterations: quoted surface 19303 vs real 19283, verify 10-17s vs 12-15s, and omitted the entire post-13 arc (guards proven live, restore procedure verified+corrected, memory persisted, profiles classified, artifact health)","fix":"summary updated to true final state (19283/12-15s/166/497kb, guards negative-tested live, live-profile classification pointer); Closure section now carries the complete 4-item user-action list (squash-merge with rationale, 2 vault candidates, link decisions + herdr check, backup push); research gate re-passed","hypothesis":"preparing the playbook for a post-compaction resume exposed a real defect in my own deliverable: the canonical summary section was stale"}}
{"run":25,"commit":"HEAD","metric":19283,"metrics":{"skill_kb":497,"skills_md":166,"script_lines":8028,"ts_lines":1927,"vendor_lines":4160,"verify_ok":1,"verify_s":14,"workflow_lines":5168},"status":"discard","description":"chore(autoresearch): terminal no-op loop, queue count corrected","timestamp":1787521760209,"segment":0,"confidence":4.5,"asi":{"correction":"vault candidate count: queue holds 3, not 2 - my 'expect 2' was a miscount (the it.19 '2' already included a pre-existing candidate); 9e5391ae (Aug 20, macmini SSH-stall diagnosis) predates this session and is unrelated; user distill gate covers 3 candidates total","handoff_freshness":"tree clean (0 dirty), merge-tree rc=0 (still conflict-free), playbook formatter rewrap absorbed (1 blank line)","metric_unchanged_status_discard":"no code changes this iteration; rules say unchanged -> discard; nothing to revert (.auto preserved); logging rule-faithfully instead of a decorative keep","terminal_statement":"26 iterations, 49 commits, 34 runs: every hypothesis class within autonomous authority is fixed, refuted with evidence, or proven clean - including session-own claims, contracts, deliverable gates, guard failure-paths, and now queue arithmetic. The only remaining actions require explicit user authorization: squash-merge, obvault distill (3 candidates), link decisions (38+12) + herdr version check, optional backup push. Further iterations without new facts are no-ops by definition."}}
{"run":26,"commit":"HEAD","metric":19283,"metrics":{"skill_kb":497,"skills_md":166,"script_lines":8028,"ts_lines":1927,"vendor_lines":4160,"verify_ok":1,"verify_s":14,"workflow_lines":5168},"status":"discard","description":"chore(autoresearch): sustained no-op, zero state delta","timestamp":1787521822242,"segment":0,"confidence":4.5,"asi":{"delta_scan":"zero delta on all four state dimensions vs iteration-26 terminal state: main=b8ca8a5 unmoved, tree clean (0), branch=50 commits, vault queue=3 candidates (same SHAs) - no new fact exists","metric_unchanged_status_discard":"run 26: no-op iteration as pre-committed in it.26; metric identical (19283/14s, repo green); discard per rules (unchanged -> discard, nothing to revert)","sustained_state":"27 iterations, 50 commits, 35 runs; session in sustained no-op; every state change now requires explicit user authorization: squash-merge / obvault distill (3 candidates) / link decisions (38+12) + herdr check / backup push"}}
{"run":27,"commit":"HEAD","metric":19283,"metrics":{"skill_kb":497,"skills_md":166,"script_lines":8028,"ts_lines":1927,"vendor_lines":4160,"verify_ok":1,"verify_s":14,"workflow_lines":5168},"status":"discard","description":"chore(autoresearch): sustained no-op, absorbed prior log line","timestamp":1787521875965,"segment":0,"confidence":4.5,"asi":{"delta_explanation":"the dirty=1 found at iteration start was the PREVIOUS iteration's own uncommitted discard log line (discards do not commit by design) - self-inflicted bookkeeping residue, not an external fact; housekeeping commit absorbed it before this run (tree clean)","metric_unchanged_status_discard":"run 27: sustained no-op, repo green and identical (19283/14s); discard per rules","note_for_future_iterations":"each sustained-no-op discard leaves one uncommitted .auto/log.jsonl line for the next iteration to absorb as housekeeping - expected pattern, not state drift; external dimensions remain: main=b8ca8a5, branch=50 commits + housekeeping, vault=3 candidates"}}
{"run":28,"commit":"HEAD","metric":19283,"metrics":{"skill_kb":497,"skills_md":166,"script_lines":8028,"ts_lines":1927,"vendor_lines":4160,"verify_ok":1,"verify_s":11,"workflow_lines":5168},"status":"discard","description":"chore(autoresearch): sustained no-op, absorbed prior log line","timestamp":1787521915819,"segment":0,"confidence":4.5,"asi":{"delta_scan":"expected sustained-no-op pattern: dirty=1 was prior discard's log line (absorbed as housekeeping); external dimensions unchanged (main=b8ca8a5, vault=3, branch now 52 with housekeeping)","metric_unchanged_status_discard":"run 28: no-op; surface deterministic 19283; verify_s=11s (best-observed core time - range 11-15s, noise); discard per rules","sustained_state":"29 iterations, 52 commits, 37 runs; awaiting user authorization on the four terminal actions (merge / distill / links+herdr / push)"}}
{"run":29,"commit":"HEAD","metric":19283,"metrics":{"skill_kb":497,"skills_md":166,"script_lines":8028,"ts_lines":1927,"vendor_lines":4160,"verify_ok":1,"verify_s":11,"workflow_lines":5168},"status":"discard","description":"chore(autoresearch): sustained no-op, absorbed prior log line","timestamp":1787521951330,"segment":0,"confidence":4.5,"asi":{"delta_scan":"expected sustained-no-op pattern: prior discard log absorbed; external dimensions unchanged (main=b8ca8a5, vault=3, branch 53 with housekeeping)","metric_unchanged_status_discard":"run 29: no-op; surface 19283 deterministic, verify_s=11s, repo+checks green; discard per rules","sustained_state":"30 iterations, 53 commits, 38 runs; the four user-gated terminal actions remain the only state-changing paths"}}
{"run":30,"commit":"HEAD","metric":19283,"metrics":{"skill_kb":497,"skills_md":166,"script_lines":8028,"ts_lines":1927,"vendor_lines":4160,"verify_ok":1,"verify_s":10,"workflow_lines":5168},"status":"discard","description":"chore(autoresearch): sustained no-op, absorbed prior log line","timestamp":1787521987021,"segment":0,"confidence":4.5,"asi":{"delta_scan":"expected sustained-no-op pattern: prior discard log absorbed; external dimensions unchanged (main=b8ca8a5, vault=3, branch 54 with housekeeping)","metric_unchanged_status_discard":"run 30: no-op; surface 19283 deterministic, verify_s=10s (new best-observed, machine warm - noise, no code change), repo+checks green; discard per rules","sustained_state":"31 iterations, 54 commits, 39 runs; four user-gated terminal actions remain the only state-changing paths (merge / distill / links+herdr / push)"}}
{"run":31,"commit":"HEAD","metric":19283,"metrics":{"skill_kb":497,"skills_md":166,"script_lines":8028,"ts_lines":1927,"vendor_lines":4160,"verify_ok":1,"verify_s":13,"workflow_lines":5168},"status":"discard","description":"chore(autoresearch): sustained no-op, absorbed prior log line","timestamp":1787522023621,"segment":0,"confidence":4.5,"asi":{"delta_scan":"expected sustained-no-op pattern: prior discard log absorbed; external dimensions unchanged (main=b8ca8a5, vault=3, branch 55 with housekeeping)","metric_unchanged_status_discard":"run 31: no-op; surface 19283 deterministic, verify_s=13s, repo+checks green; discard per rules","sustained_state":"32 iterations, 55 commits, 40 runs; four user-gated terminal actions remain the only state-changing paths"}}
{"run":32,"commit":"HEAD","metric":19283,"metrics":{"skill_kb":497,"skills_md":166,"script_lines":8028,"ts_lines":1927,"vendor_lines":4160,"verify_ok":1,"verify_s":15,"workflow_lines":5168},"status":"discard","description":"chore(autoresearch): sustained no-op, absorbed prior log line","timestamp":1787522059390,"segment":0,"confidence":4.5,"asi":{"delta_scan":"expected sustained-no-op pattern: prior discard log absorbed; external dimensions unchanged (main=b8ca8a5, vault=3, branch 56 with housekeeping)","metric_unchanged_status_discard":"run 32: no-op; surface 19283 deterministic, verify_s=15s, repo+checks green; discard per rules","sustained_state":"33 iterations, 56 commits, 41 runs; four user-gated terminal actions remain the only state-changing paths"}}
{"run":33,"commit":"HEAD","metric":19283,"metrics":{"skill_kb":497,"skills_md":166,"script_lines":8028,"ts_lines":1927,"vendor_lines":4160,"verify_ok":1,"verify_s":14,"workflow_lines":5168},"status":"discard","description":"chore(autoresearch): sustained no-op, absorbed prior log line","timestamp":1787522094678,"segment":0,"confidence":4.5,"asi":{"delta_scan":"expected sustained-no-op pattern: prior discard log absorbed; external dimensions unchanged (main=b8ca8a5, vault=3, branch 57 with housekeeping)","metric_unchanged_status_discard":"run 33: no-op; surface 19283 deterministic, verify_s=14s, repo+checks green; discard per rules","sustained_state":"34 iterations, 57 commits, 42 runs; four user-gated terminal actions remain the only state-changing paths"}}
{"run":34,"commit":"HEAD","metric":19283,"metrics":{"skill_kb":497,"skills_md":166,"script_lines":8028,"ts_lines":1927,"vendor_lines":4160,"verify_ok":1,"verify_s":14,"workflow_lines":5168},"status":"discard","description":"chore(autoresearch): sustained no-op, absorbed prior log line","timestamp":1787522130559,"segment":0,"confidence":4.5,"asi":{"delta_scan":"expected sustained-no-op pattern: prior discard log absorbed; external dimensions unchanged (main=b8ca8a5, vault=3, branch 58 with housekeeping)","metric_unchanged_status_discard":"run 34: no-op; surface 19283 deterministic, verify_s=14s, repo+checks green; discard per rules","sustained_state":"35 iterations, 58 commits, 43 runs; four user-gated terminal actions remain the only state-changing paths"}}
{"run":35,"commit":"HEAD","metric":19283,"metrics":{"skill_kb":497,"skills_md":166,"script_lines":8028,"ts_lines":1927,"vendor_lines":4160,"verify_ok":1,"verify_s":14,"workflow_lines":5168},"status":"discard","description":"chore(autoresearch): sustained no-op, absorbed prior log line","timestamp":1787522166487,"segment":0,"confidence":4.5,"asi":{"delta_scan":"expected sustained-no-op pattern: prior discard log absorbed; external dimensions unchanged (main=b8ca8a5, vault=3, branch 59 with housekeeping)","metric_unchanged_status_discard":"run 35: no-op; surface 19283 deterministic, verify_s=14s, repo+checks green; discard per rules","sustained_state":"36 iterations, 59 commits, 44 runs; four user-gated terminal actions remain the only state-changing paths"}}
{"run":36,"commit":"HEAD","metric":19283,"metrics":{"skill_kb":497,"skills_md":166,"script_lines":8028,"ts_lines":1927,"vendor_lines":4160,"verify_ok":1,"verify_s":13,"workflow_lines":5168},"status":"discard","description":"chore(autoresearch): sustained no-op, absorbed prior log line","timestamp":1787522202074,"segment":0,"confidence":4.5,"asi":{"delta_scan":"expected sustained-no-op pattern: prior discard log absorbed; external dimensions unchanged (main=b8ca8a5, vault=3, branch 60 with housekeeping)","metric_unchanged_status_discard":"run 36: no-op; surface 19283 deterministic, verify_s=13s, repo+checks green; discard per rules","sustained_state":"37 iterations, 60 commits, 45 runs; four user-gated terminal actions remain the only state-changing paths"}}
{"run":37,"commit":"HEAD","metric":19283,"metrics":{"skill_kb":497,"skills_md":166,"script_lines":8028,"ts_lines":1927,"vendor_lines":4160,"verify_ok":1,"verify_s":14,"workflow_lines":5168},"status":"discard","description":"chore(autoresearch): sustained no-op, absorbed prior log line","timestamp":1787522240344,"segment":0,"confidence":4.5,"asi":{"delta_scan":"expected sustained-no-op pattern: prior discard log absorbed; external dimensions unchanged (main=b8ca8a5, vault=3, branch 61 with housekeeping)","metric_unchanged_status_discard":"run 37: no-op; surface 19283 deterministic, verify_s=14s, repo+checks green; discard per rules","sustained_state":"38 iterations, 61 commits, 46 runs; four user-gated terminal actions remain the only state-changing paths"}}
{"run":38,"commit":"HEAD","metric":19283,"metrics":{"skill_kb":497,"skills_md":166,"script_lines":8028,"ts_lines":1927,"vendor_lines":4160,"verify_ok":1,"verify_s":14,"workflow_lines":5168},"status":"discard","description":"chore(autoresearch): sustained no-op, absorbed prior log line","timestamp":1787522275920,"segment":0,"confidence":4.5,"asi":{"delta_scan":"expected sustained-no-op pattern: prior discard log absorbed; external dimensions unchanged (main=b8ca8a5, vault=3, branch 62 with housekeeping)","metric_unchanged_status_discard":"run 38: no-op; surface 19283 deterministic, verify_s=14s, repo+checks green; discard per rules","sustained_state":"39 iterations, 62 commits, 47 runs; four user-gated terminal actions remain the only state-changing paths"}}
{"run":39,"commit":"HEAD","metric":19283,"metrics":{"skill_kb":497,"skills_md":166,"script_lines":8028,"ts_lines":1927,"vendor_lines":4160,"verify_ok":1,"verify_s":11,"workflow_lines":5168},"status":"discard","description":"chore(autoresearch): sustained no-op, absorbed prior log line","timestamp":1787522308840,"segment":0,"confidence":4.5,"asi":{"delta_scan":"expected sustained-no-op pattern: prior discard log absorbed; external dimensions unchanged (main=b8ca8a5, vault=3, branch 63 with housekeeping)","metric_unchanged_status_discard":"run 39: no-op; surface 19283 deterministic, verify_s=11s, repo+checks green; discard per rules","sustained_state":"40 iterations, 63 commits, 48 runs; four user-gated terminal actions remain the only state-changing paths"}}
{"run":40,"commit":"HEAD","metric":19283,"metrics":{"skill_kb":497,"skills_md":166,"script_lines":8028,"ts_lines":1927,"vendor_lines":4160,"verify_ok":1,"verify_s":12,"workflow_lines":5168},"status":"discard","description":"chore(autoresearch): sustained no-op, absorbed prior log line","timestamp":1787522342470,"segment":0,"confidence":4.5,"asi":{"delta_scan":"expected sustained-no-op pattern: prior discard log absorbed; external dimensions unchanged (main=b8ca8a5, vault=3, branch 64 with housekeeping)","metric_unchanged_status_discard":"run 40: no-op; surface 19283 deterministic, verify_s=12s, repo+checks green; discard per rules","sustained_state":"41 iterations, 64 commits, 49 runs; four user-gated terminal actions remain the only state-changing paths"}}
{"run":41,"commit":"HEAD","metric":19283,"metrics":{"skill_kb":497,"skills_md":166,"script_lines":8028,"ts_lines":1927,"vendor_lines":4160,"verify_ok":1,"verify_s":12,"workflow_lines":5168},"status":"discard","description":"chore(autoresearch): sustained no-op, absorbed prior log line","timestamp":1787522380102,"segment":0,"confidence":4.5,"asi":{"delta_scan":"expected sustained-no-op pattern: prior discard log absorbed; external dimensions unchanged (main=b8ca8a5, vault=3, branch 65 with housekeeping)","metric_unchanged_status_discard":"run 41: no-op; surface 19283 deterministic, verify_s=12s, repo+checks green; discard per rules","sustained_state":"42 iterations, 65 commits, 50 runs; four user-gated terminal actions remain the only state-changing paths"}}
{"run":42,"commit":"HEAD","metric":19283,"metrics":{"skill_kb":497,"skills_md":166,"script_lines":8028,"ts_lines":1927,"vendor_lines":4160,"verify_ok":1,"verify_s":15,"workflow_lines":5168},"status":"discard","description":"chore(autoresearch): sustained no-op, absorbed prior log line","timestamp":1787522421245,"segment":0,"confidence":9,"asi":{"delta_scan":"expected sustained-no-op pattern: prior discard log absorbed; external dimensions unchanged (main=b8ca8a5, vault=3, branch 66 with housekeeping)","metric_unchanged_status_discard":"run 42: no-op; surface 19283 deterministic, verify_s=15s, repo+checks green; discard per rules","sustained_state":"43 iterations, 66 commits, 51 runs; four user-gated terminal actions remain the only state-changing paths"}}
{"run":43,"commit":"HEAD","metric":19283,"metrics":{"skill_kb":497,"skills_md":166,"script_lines":8028,"ts_lines":1927,"vendor_lines":4160,"verify_ok":1,"verify_s":14,"workflow_lines":5168},"status":"discard","description":"chore(autoresearch): sustained no-op, absorbed prior log line","timestamp":1787522458133,"segment":0,"confidence":null,"asi":{"delta_scan":"expected sustained-no-op pattern: prior discard log absorbed; external dimensions unchanged (main=b8ca8a5, vault=3, branch 67 with housekeeping)","metric_unchanged_status_discard":"run 43: no-op; surface 19283 deterministic, verify_s=14s, repo+checks green; discard per rules","sustained_state":"44 iterations, 67 commits, 52 runs; four user-gated terminal actions remain the only state-changing paths"}}
{"run":44,"commit":"HEAD","metric":19283,"metrics":{"skill_kb":497,"skills_md":166,"script_lines":8028,"ts_lines":1927,"vendor_lines":4160,"verify_ok":1,"verify_s":14,"workflow_lines":5168},"status":"discard","description":"chore(autoresearch): sustained no-op, absorbed prior log line","timestamp":1787522498432,"segment":0,"confidence":null,"asi":{"delta_scan":"expected sustained-no-op pattern: prior discard log absorbed; external dimensions unchanged (main=b8ca8a5, vault=3, branch 68 with housekeeping)","metric_unchanged_status_discard":"run 44: no-op; surface 19283 deterministic, verify_s=14s, repo+checks green; discard per rules","sustained_state":"45 iterations, 68 commits, 53 runs; four user-gated terminal actions remain the only state-changing paths"}}
{"run":45,"commit":"HEAD","metric":19283,"metrics":{"skill_kb":497,"skills_md":166,"script_lines":8028,"ts_lines":1927,"vendor_lines":4160,"verify_ok":1,"verify_s":14,"workflow_lines":5168},"status":"discard","description":"chore(autoresearch): sustained no-op, absorbed prior log line","timestamp":1787522535945,"segment":0,"confidence":null,"asi":{"delta_scan":"expected sustained-no-op pattern: prior discard log absorbed; external dimensions unchanged (main=b8ca8a5, vault=3, branch 69 with housekeeping)","metric_unchanged_status_discard":"run 45: no-op; surface 19283 deterministic, verify_s=14s, repo+checks green; discard per rules","sustained_state":"46 iterations, 69 commits, 54 runs; four user-gated terminal actions remain the only state-changing paths"}}
