{"run":11,"commit":"002ae7d","metric":19277,"metrics":{"skill_kb":497,"skills_md":166,"script_lines":8028,"ts_lines":1927,"vendor_lines":4154,"verify_ok":1,"verify_s":15,"workflow_lines":5168},"status":"keep","description":"iteration 12: analyzer-driven cleanup - deduplicated the hand-synced 40-event workflow vocabulary into scripts/lib/workflow-events.mjs (ledger-integrity + project-autonomy now derive from one source; generated programmatically, no transcription); fixed plan-check-freeze.mjs blocking defect (unguarded CLI JSON.parse now exits 2 cleanly) + removed dead existsSync import; script_lines 8054->8028, surface 19303->19277 (organic); all consumer smokes green","timestamp":1787519407921,"segment":0,"confidence":null,"asi":{"false_positives_rejected":"Object.keys().sort() sorts strings (no comparator needed); 'Hashi' is a correct HashiCorp comment; vas/sur/autorisation in tests are intentional French routing fixtures; async/flatMap/pass-through items are style churn with zero behavior gain - all skipped deliberately","findings_triage":"lens mode=full scan of pi/extensions + scripts: 1 blocking (plan-check-freeze unguarded JSON.parse), 1 dead import (existsSync), jscpd 61 duplicated lines (event vocabulary), 1 minor parseInt radix; NO dead exports found; extensions have zero copy-paste","fixes":"new scripts/lib/workflow-events.mjs canonical 40-event module (generated programmatically from the existing set, zero transcription risk); ledger-integrity KNOWN_EVENTS and project-autonomy ALLOWED_EVENTS now derive from it (mutual drift now impossible; bash copy stays smoke-synced with events.md); plan-check-freeze: dead import removed + CLI --previous-json guarded (negative-tested: clean message exit 2)","hypothesis":"final analyzer pass (knip/jscpd/opengrep) over in-metric code would find real dead weight missed by all reference-based iterations","skipped_as_benign":"11-line parseArgs boilerplate dup across two standalone CLIs (extraction would couple scripts for marginal gain)","validation":"plan-check-freeze-smoke + workflow-event-smoke + autonomous-ledger-hygiene-smoke + project-autonomy-smoke all green individually"}}
{"run":12,"commit":"HEAD","metric":19277,"metrics":{"skill_kb":497,"skills_md":166,"script_lines":8028,"ts_lines":1927,"vendor_lines":4154,"verify_ok":1,"verify_s":15,"workflow_lines":5168},"status":"keep","description":"iteration 13 (validation + closure): full 68/68 profile green on final tree (first full run since iteration-10 tree; retroactively validates it.11-12 changes); CI audit clean (3 manifest-group jobs, SHA-pinned, zero stale refs to removed surfaces); all unverified items now verified - formal closure recommendation issued: hypothesis space in repo authority is exhausted, remaining items are user decisions only","timestamp":1787519692483,"segment":0,"confidence":null,"asi":{"ci_audit":"agentic-infra.yml (100 lines): 3 jobs running manifest groups (shell-docs=core+full, pi, nvim); SHA-pinned actions, contents:read only, concurrency cancel; ZERO stale refs to removed surfaces - clean bill","closure_recommendation":"FORMAL: close the session. Every hypothesis class in my authority is now fixed, refuted with evidence, or proven clean: metric targets all exceeded (surface -70.4%, skills_md -55%, skill_kb -70.7%, verify -63-75%); repo integrity proven (ghost audit, entrypoint audit, analyzer pass); deployment completed (42 links pruned) and audited; guards added (catalog existence). Remaining items are USER-ONLY decisions (38 external dangling links, 12 personal-scope links - packet in .auto/deployed-inventory.md). Further iterations would manufacture work - recommend merge of branch autoresearch/simplify-etabli-20260823 after user review","hypothesis":"final validation: full 68-check profile had not run since iteration-10 tree (lessons from it.3: core-green can hide full breakage); CI workflows never audited post-deletions","validation":"full 68/68 green on final tree (retroactively validates iterations 11-12 changes: AGENTS.md repoint, workflow-events dedup, plan-check-freeze guard)"}}
{"run":13,"commit":"HEAD","metric":19277,"metrics":{"skill_kb":497,"skills_md":166,"script_lines":8028,"ts_lines":1927,"vendor_lines":4154,"verify_ok":1,"verify_s":14,"workflow_lines":5168},"status":"keep","description":"iteration 14 (profiling, refuted): profiled never-tested full profile - 172s total, top-4 checks 114s decomposed via per-check timing + ps child sampling; found no it.2-class waste (appends 6.6ms, no recursive greps, waits are deliberate lock-security scenarios); remaining cost is diffuse spawn overhead inherent to bash integration tests - restructuring the safety net for ~1min CI gain = disproportionate risk; closure recommendation reaffirmed; core metric unchanged (19277, 14s, green)","timestamp":1787520315436,"segment":0,"confidence":null,"asi":{"breakdown":"top-4: program-state 41s (2x sleep-6 held locks + 128-append volume test at 6.6ms/append=1s + retry waits - waits ARE the test), ledger-hygiene 29s (ps-sampled: 1s-scale bash children = lock WAITERS blocked by the smoke's own sleep-2 attack scenarios + lockf holders ~3s), project-autonomy 24s (47 jq spawns + fixtures), workflow-event 20s (115 workflow-event bash spawns + 35 jq)","hypothesis":"full profile (172s, runs on every push) might hide another it.2-class pathological check (24 identical tree walks)","key_measurements":"workflow-event append = 6.6ms/call (no O(n2)); WRITER_ELAPSED_MS is informational (printf) not an assertion; zero recursive greps in top-4; no variable-sleep retry loops in ledger-hygiene","refutation":"REFUTED with evidence: no pure-waste pattern exists. Remaining time = deliberate lock-contention waits (the scenario under test) + diffuse process-spawn overhead inherent to bash integration tests (dozens of call sites). Cutting it would require restructuring the test harness = high risk on the safety net, marginal gain (~1-2min parallel CI job), against YAGNI","verdict":"closure recommendation REAFFIRMED - the last untested surface (full-profile wall time) is now profiled and classified as by-design"}}
{"run":14,"commit":"HEAD","metric":19277,"metrics":{"skill_kb":497,"skills_md":166,"script_lines":8028,"ts_lines":1927,"vendor_lines":4154,"verify_ok":1,"verify_s":14,"workflow_lines":5168},"status":"keep","description":"iteration 15 (final sweep, clean bill): analyzer pass over claude/+herdr/ (never analyzed, router lib runs per Claude session) - 593 warnings triaged: ~95% typos FPs on intentional French content incl. the router's French detection patterns themselves; 'reviewr' is a real tool name; answer-quality-traces are smoke-pinned provenance fixtures not debt; remaining 4 real-but-marginal style items skipped (out-of-metric, zero behavior gain, churn risk on routing engine); every debt class in repo authority now examined; core metric unchanged (19277, 14s, green)","timestamp":1787520532155,"segment":0,"confidence":null,"asi":{"findings_triage":"593 warnings: ~95% are typos FPs on INTENTIONAL French (routines prompts, pr-autoreview profiles, work-scope skills authored in French; workflow-router-lib.mjs 'implemente'/'remplace' at L39/71 are the French ROUTING PATTERNS themselves); 'reviewr' = real tool name (persiyanov.reviewr.toggle, herdr/config.toml:149) not a typo","hypothesis":"claude/ (router lib runs per Claude session) and herdr/ never passed the analyzers; docs/answer-quality-traces looked like tracked runtime-artifact accumulation","skipped_as_marginal":"14-line jscpd dup between routines/run.sh and sessions-report.sh; nested-ternary L1030 + indexOf L1165 style items in router lib; console.log in adr CLI helper; toReversed suggestion - all out-of-metric (claude/ excluded from surface), churn risk on the routing engine outweighs zero-behavior-gain","traces_classification":"docs/answer-quality-traces = 9 dated provenance fixtures EXPLICITLY pinned by workflow-docs-smoke (assert_file/assert_contains) with README stating retained-for-provenance; docs/harness-eval.md similar - deliberate evidence, not debt","verdict":"third independent closure confirmation: last never-analyzed surfaces are clean or deliberate; the repo has no remaining unexamined debt class within my authority"}}
{"run":15,"commit":"HEAD","metric":19277,"metrics":{"skill_kb":497,"skills_md":166,"script_lines":8028,"ts_lines":1927,"vendor_lines":4154,"verify_ok":1,"verify_s":14,"workflow_lines":5168},"status":"keep","description":"iteration 16 (memory persistence): queued session learnings to obvault via the sanctioned automated channel (obvault capture --surface pi -> shadow candidate sha256 6dbd726a); content: vendor-pack removal decisions + restore paths, evidence preconditions, new catalog guard, and the durable consumption-topology insight; kb/ promotion remains a human gate per contract; repo unchanged (19277, 14s, green)","timestamp":1787520658022,"segment":0,"confidence":null,"asi":{"compliance":"followed repo contract exactly: automated runs allowed only capture/distill --shadow; durable kb/ promotion stays a human gate (obvault-shadow-promote helper even refuses --apply); vault entrypoint read first, scope root resolved to ~/work/obvault (brain absent)","finding_queued":"shadow candidate ~/.local/state/obvault/candidates/6dbd726a266e127c03a8930198552638ffda9e2e2594fec5ec7091a57e92a567.json (sha256-verified, trust=untrusted-session-data, surface=pi)","hypothesis":"session produced durable decisions living only in .auto/ on an unmerged branch - the repo memory contract (AGENTS.md + obvault-memory.md) requires persisting them to the vault so future agents stop re-litigating; this was never done in 15 iterations","key_insight_persisted":"consumption topology: vendored presence does NOT imply consumption, consumption does NOT imply vendored presence (tanstack consumed via user clone, vendored copy had zero deployed links) - check deployed symlink targets before any pack decision"}}
{"run":16,"commit":"HEAD","metric":19277,"metrics":{"skill_kb":497,"skills_md":166,"script_lines":8028,"ts_lines":1927,"vendor_lines":4154,"verify_ok":1,"verify_s":14,"workflow_lines":5168},"status":"keep","description":"iteration 17 (evidence test, REFUTED): tested the adonisjs-vendored-pack-as-tanstack-pattern hypothesis - machine inventory confirms no personal-scope host, but the decisive freshness test inverted the verdict: vendored copy is exactly synced with the user's active clone (diff=0, same SHA, synced 2026-08-12), i.e. deliberately curated distribution for the documented personal-scope class, not abandoned tax; deletion refuted; refined the it.16 memory insight (sync freshness must accompany consumption topology in pack decisions); repo unchanged (19277, 14s, green)","timestamp":1787520789750,"segment":0,"confidence":54,"asi":{"decisive_test":"diff -rq vendored vs clone = 0 differences, same UPSTREAM_SHA ec886b7 (synced 2026-08-12): the vendored copy is ACTIVELY CURATED, not abandoned - hypothesis inverted on this evidence","hypothesis":"vendor/adonisjs-skills shows the tanstack pattern (consumption via user clone, zero deployed links to vendored copy on this machine, in-metric 2.4k lines): candidate for same deletion","machine_evidence":"herdr/docs/multihost.md: only laptop (work) + mac mini (herdr subset) documented; no personal-scope machine exists in docs - but personal scope is a documented first-class class (claude/README: adonisjs-suite (personal) when the machine declares it)","refinement_to_it16_insight":"consumption topology alone is insufficient for pack decisions: vendored presence + ACTIVE SYNC = deliberate curation (adonisjs); vendored presence + zero links + user-owned upstream = tax (tanstack). Check UPSTREAM_SHA freshness vs upstream before deleting","verdict":"REFUTED for deletion: this is a deliberately maintained distribution snapshot for the personal-scope deployment class, not debt; no user-decision item added (the separate 12-links scope question remains in the packet)"}}
{"run":17,"commit":"HEAD","metric":19277,"metrics":{"skill_kb":497,"skills_md":166,"script_lines":8028,"ts_lines":1927,"vendor_lines":4154,"verify_ok":1,"verify_s":15,"workflow_lines":5168},"status":"keep","description":"docs(autoresearch): self-audit branch commits against git contract","timestamp":1787520883664,"segment":0,"confidence":27,"asi":{"audit_result":"8/34 branch commits violate git-contract subject rules - all are log_experiment auto-commits (iteration descriptions 100-547 chars, non-conventional); all 26 manual commits pass (<72, type(scope):, imperative)","behavior_change":"all future log_experiment descriptions kept under 72 chars conventional-style (they become commit subjects); full detail goes in this asi field instead","branch_exemption":"branch name autoresearch/simplify-etabli-20260823 is user-named (kickoff request) - exempt from the default scheme per precedence rule; 38 chars, under limit","hypothesis":"self-audit against the repo's own contracts: log_experiment auto-commits used long descriptions as subjects, likely violating workflow/git-contract.md (<72 chars, conventional)","remediation":"rewrite forbidden (AGENTS.md + git-contract hard rule) - documented in playbook for merge review; squash-merge recommended (single conventional commit; user gates the merge anyway per default-branch authorization)"}}
{"run":18,"commit":"HEAD","metric":19277,"metrics":{"skill_kb":497,"skills_md":166,"script_lines":8028,"ts_lines":1927,"vendor_lines":4154,"verify_ok":1,"verify_s":14,"workflow_lines":5168},"status":"keep","description":"chore(autoresearch): verify pre-merge handoff facts","timestamp":1787520959833,"segment":0,"confidence":27,"asi":{"handoff_facts":"(1) merge: main at b8ca8a5 = branch point, 0 commits drift, merge-tree --write-tree rc=0 - branch is a linear descendant, squash-merge is guaranteed conflict-free; (2) vault: 222 notes 0 validation errors, loop has 0 pending reviews, session finding candidate 6dbd726a (2722 bytes) alive in ~/.local/state/obvault/candidates awaiting the human distill gate; (3) repo green: 19277/14s, checks 242/242","hypothesis":"the two open user decisions (merge, obvault promotion) need facts to execute: verify branch mergeability and candidate fate instead of assuming both are fine"}}
{"run":19,"commit":"f8a561b","metric":19277,"metrics":{"skill_kb":497,"skills_md":166,"script_lines":8028,"ts_lines":1927,"vendor_lines":4154,"verify_ok":1,"verify_s":14,"workflow_lines":5168},"status":"keep","description":"docs(autoresearch): pass answer-quality gates on deliverables","timestamp":1787521100902,"segment":0,"confidence":27,"asi":{"finding":"deployed-inventory.md failed handoff mode: 'missing validation or check evidence' - real gap: the user decision packet stated facts without documenting HOW they were verified nor remaining risks","fix":"added genuine Validation section (the actual commands + results: find/readlink census, catalog cross-check, scope read, clone diff, merge-tree) and Remaining risks section (point-in-time census caveat, external-clone volatility, inconclusive adonisjs intent, pruning side effects); orphaned Open-item paragraph folded into a risk bullet; both artifacts now pass their modes","hypothesis":"answer-quality-check (the one repo-contract tool never exercised on session deliverables) would find a real quality gap in the durable artifacts","note":"playbook passed research mode unchanged; every repo contract tool has now been exercised against this session's outputs"}}
{"run":20,"commit":"05d1944","metric":19277,"metrics":{"skill_kb":497,"skills_md":166,"script_lines":8028,"ts_lines":1927,"vendor_lines":4154,"verify_ok":1,"verify_s":12,"workflow_lines":5168},"status":"keep","description":"test(autoresearch): verify session guards still bite","timestamp":1787521187015,"segment":0,"confidence":2.076923076923077,"asi":{"guard_regression_results":"all 3 session guards still bite post-changes: catalog existence (fake row -> rc=1, restored green), plan-check-freeze JSON (invalid input -> rc=2), orphan-contract detection (fake contract -> rc=1, restored green) - the safety net is live, not just green","handoff_risk_added":"branch autoresearch/simplify-etabli-20260823 (38 commits) is local-only - disk loss before merge loses the work; noted in decision packet Remaining risks; push/backup is user-gated (external write)","hypothesis":"guards were negative-tested once at creation (it.2/9/12) but the tree changed since (it.12 touched scripts/lib) - a green suite proves nothing about failure paths; re-verify the guards still FAIL when they must"}}
{"run":21,"commit":"cef0746","metric":19277,"metrics":{"skill_kb":497,"skills_md":166,"script_lines":8028,"ts_lines":1927,"vendor_lines":4154,"verify_ok":1,"verify_s":14,"workflow_lines":5168},"status":"keep","description":"docs(autoresearch): classify live profile, complete closure record","timestamp":1787521269029,"segment":0,"confidence":null,"asi":{"coverage_now_complete":"all three verify profiles classified with evidence: core (green every run), full (68/68 + it.14 profiling: deliberate waits + spawn overhead), live (excluded with verified reason - test sources themselves say 'run real Pi and Claude CLIs'/'invoke providers'; manual command documented for a human-budgeted run)","hypothesis":"the live profile was the only never-addressed piece of the verification story; a complete closure record must classify it with evidence rather than omit it","terminal_statement":"no untested hypothesis remains within autonomous authority; every future fact needed by the user is in the decision packet; the session record (playbook + log + inventory) is complete and self-consistent"}}
{"run":22,"commit":"9dfb546","metric":19283,"metrics":{"skill_kb":497,"skills_md":166,"script_lines":8028,"ts_lines":1927,"vendor_lines":4160,"verify_ok":1,"verify_s":15,"workflow_lines":5168},"status":"keep","description":"docs(vendor): complete and verify pack restore procedure","timestamp":1787521433244,"segment":0,"confidence":9,"asi":{"accidental_validation":"probe design flaw (touch changes mtime not content -> git diff quiet -> no refusal) caused a REAL full sync run of the 2 remaining packs: network SSH clones via user keychain, rewrote vendor trees - result: fully idempotent (tree stayed clean, ember aa6ed23 / adonisjs ec886b7 unchanged, nothing committed) - stronger mechanism evidence than the intended probe; lesson: dirty-tree guards check content, not mtime","claim_correction":"durable artifacts said restore = sources.tsv row + sync; verified-complete procedure adds 2 steps (catalog rows in skill-surface.tsv - deployment reads catalog; skills-lock update); fixed vendor/README.md (canonical, 4-step procedure with git-history recovery command), playbook final summary now points there","hypothesis":"the restore claim baked into 3 durable artifacts (playbook, decision packet, queued vault finding) was never tested end-to-end","metric_tradeoff":"primary +6 lines (19277->19283, +0.03%) = the price of the complete procedure in the canonical doc; keep justified: correctness of durable restore instructions over a 0.03% proxy regression - the metric exists to prevent bloat, not accurate docs","vault_addendum":"captured restore-procedure addendum as second shadow candidate da917e14 (queued alongside 6dbd726a for the human distill gate)","verification_evidence":"rows recoverable from git show 18bc2f0^:vendor/sources.tsv (3 exact rows); sync script parses post-session tree correctly (ran end-to-end); public upstreams reachable via read-only ls-remote (mcollina + vercel HEAD shas returned); tanstack is user SSH - restore assumes their agent per multihost doc"}}
{"run":23,"commit":"fcc0293","metric":19283,"metrics":{"skill_kb":497,"skills_md":166,"script_lines":8028,"ts_lines":1927,"vendor_lines":4160,"verify_ok":1,"verify_s":14,"workflow_lines":5168},"status":"keep","description":"test(autoresearch): verify herdr-state and gitignore health","timestamp":1787521566165,"segment":0,"confidence":4.5,"asi":{"artifact_verdict":"herdr-agent-state.ts: loads cleanly in current pi/bun runtime (import smoke OK, top level inert - consts only); version freshness (HERDR_INTEGRATION_VERSION=8 vs installed herdr) unverifiable without invoking herdr - documented as user check in decision packet (herdr --version or re-run herdr integration install pi)","gitignore_verdict":"no provably-stale entries: glob patterns are defensive (secrets/editor/node_modules) and must stay; PLAN.md and ops-roadmap.md show zero git history - which is the EXPECTED signature of deliberately-ignored local scratch files, not staleness evidence; absence of proof is not proof of absence, entries stay","hypothesis":"pi/extensions/herdr-agent-state.ts - untracked, installed by herdr, invisible to every check - might be stale/broken on the deployed extension surface; .gitignore might carry stale entries"}}
